{
  "detail_level": "standard",
  "nodes": [
    {
      "id": "c001",
      "label": "NV中心",
      "x": 100,
      "y": 120,
      "size": 160,
      "community_id": "comm_001",
      "style": { "rough": true }
    },
    {
      "id": "c002",
      "label": "温度プローブ",
      "x": 380,
      "y": 120,
      "size": 180,
      "community_id": "comm_001",
      "style": { "rough": true }
    }
  ],
  "edges": [
    {
      "id": "r001",
      "from": "c001",
      "to": "c002",
      "label": "因果",
      "glyph": "arrow"
    }
  ],
  "islands": [
    {
      "community_id": "comm_001",
      "name": "量子センサと温度計測",
      "bbox": [60, 80, 620, 250],
      "is_gap": false
    }
  ],
  "provenance": {
    "graph_version": "kg_test_001",
    "generated_for": "trace_test_001"
  }
}
